{"classification":"AUTHORITY_CONFLICT","detectionMethod":"Production-backed C1 stateful fuzzer and deterministic deletion replay, then C1.1 before/serialized/restored comparisons.","evidenceReferences":["EV-006","EV-018","EV-019","EV-020","EV-021","EV-022","EV-023"],"expectedBehavior":"Version-20 save/load preserves newer legitimate task and Evidence state while restoring valid legacy sessions.","failedApproaches":[{"approach":"Task and cached-report identity guards alone","conditionsPermittingReconsideration":"Not a complete correction unless Evidence restoration also respects its existing agent identity.","evidenceReferences":["EV-020","EV-022"],"observedOutcome":"Intermediate 200-scenario study still reproduced save_reload:evidence in seed 18279; minimized to 22 actions.","reasonAttempted":"Correct the original save_reload:tasks finding with a bounded restoration change.","whyRejected":"Evidence restoration still selected a different agent entry by task UUID alone."}],"firstObservedDate":"2026-10-08","id":"FL-015","lessons":[],"observedBehavior":"Loading matched completed sessions by stable task UUID alone, overwriting a different agent report; a partial correction left Evidence actualQuality and overclaimAmount affected.","preventionRules":[],"relatedCanonRecords":["rule.save_compatibility","system.work_sessions","rule.determinism","rule.hidden_truth"],"relatedFailureIds":["FL-002"],"relatedTests":["Tests/ChaosCrewMissionTests.swift::testC11PersistenceReview","Tests/ChaosCrewMissionTests.swift::testC11EvidencePersistenceReview","Tests/ChaosCrewMissionTests.swift::testC11CompletedAndLegacySessions","Tests/ChaosCrewMissionTests.swift::testGateDFullBoundedStudy"],"reproductionConditions":"Reviewed promotion of CF-c1-ca78b88c9c0e. C1 seeds 18195 and 18279 using ordinary GameStore actions; original task trace minimizes to 17 actions, residual Evidence trace to 22.","requiredFutureGates":[],"resolutionDate":"2026-10-09","rootCause":"Assignment UUID survives reassignment. restoreLegacyWorkSessionCausalQuality matched the old session by UUID without checking agent identity in task, cache and Evidence restoration.","rootCauseConfidence":"ESTABLISHED","schemaVersion":"1","severity":"HIGH","status":"RESOLVED","successfulCorrection":"Match session agent to assignedAgentID, cache agentID and canonical Evidence agent name. Legacy restoration, save version 20 and optional decoding remain unchanged; 157 Swift regressions and 200 exact scenario replays passed. Owner explicitly accepted the bounded repair.","system":["persistence","work sessions","assignment identity","evidence"],"title":"Legacy Work Session restoration overwrote reassigned task and Evidence state","unknownInformation":["Coverage is bounded to the tested initial careers, commands and seeds; broader assignment/session lifecycle behavior was not redesigned."],"visibility":"developer_only","whyExistingChecksMissedIt":"Existing completed-session tests did not cover changing the assigned agent before reload; the fresh study exposed the remaining Evidence branch after the task/cache guards."}
